Is the BI&A program accredited,ACCREDITATION
Is the School of Business accredited,ACCREDITATION
How long does the admission process take,ADMISSIONS_duration
What is the duration of admission,ADMISSIONS_duration
Time for admission process,ADMISSIONS_duration
Can I change my major/program,change_major
I want to change my program,change_major
My major needs to be changed,change_major
I want to switch to another major,change_major
I found another program that aligns with my choices,change_major
Where can I get help on admissions questions,Admission_questions
Where to find admission questions,Admission_questions
is there any link for admission questions,Admission_questions
More information on admission questions,Admission_questions
Who should I ask about the status of my application,Admission_questions
"As an international student, do I have to submit financial documents when I apply",int_finance_docs
Does submission of finance documents required,int_finance_docs
Financial docs submission,int_finance_docs
What is Hoboken like,Hoboken_like
How is Hoboken,Hoboken_like
How is life in Hoboken,Hoboken_like
Where is Hoboken located,Hoboken_Loc
Location of Hoboken,Hoboken_Loc
Which companies support the BI&A program,BIA_company
Companies association with BI&A program,BIA_company
BI&A program affliation with companies,BIA_company
What is the BI&A program's vision,BIA_Vision
Objective of BI&A program,BIA_Vision
Is BI&A program a STEM Program,BIA_stem
Ranking of BI&A Program,BIA_Rank
Is BI&A program ranked,BIA_Rank
How does the BI&A program compare to other programs,BIA_Rank
Does the program help develop data scientists,BIA_Datascience
Can I become Data Scientist,BIA_Datascience
Does the program help develop job skills,BIA_JOBSkills
Which Job skills do I develop,BIA_JOBSkills
How do I obtain an industry internship,BIA_Internship
Will I get Internship,BIA_Internship
Do BIA students get Internship,BIA_Internship
How many students are in the masters degree program,BIA_Stud_strength
How many Students passed out in year,BIA_Stud_strength
What kind of students are in the program,BIA_Stud_Profile
Typical student's profile,BIA_Stud_Profile
Required courses in the BIA Program,BIA_Req_course
Is the program offered online,BIA_Req_course
Any Online courses,BIA_Online_Course
Can we learn online,BIA_Online_Course
What are the salaries of BI&A graduates,BIA_Salary
Average Salary of the Program,BIA_Salary
Minimum Salary of program,BIA_Salary
Can I pursue two programs simultaneously,Two_Programs
Can I enroll for two programs,Two_Programs
Could i seek after two programs simultaneously,Two_Programs
Do you accept applications after the deadline,Application_Deadline
Acceptance of application after deadline,Application_Deadline
Can I submit application after Deadline,Application_Deadline
What is I submit application after deadline,Application_Deadline
How can I check the status of my application,Application_Status
Checking status of my application,Application_Status
Where can I check the application status,Application_Status
How to check application status,Application_Status
What is the SAGE program,SAGE_Program
Tell me something about SAGE,SAGE_Program
What is SAGE,SAGE_Program
SAGE program,SAGE_Program
How can I apply for the Data Science concentration,DataScienceApp
Can I apply for Data Science Concentration,DataScienceApp
Application for Data Science Concentration,DataScienceApp
What courses are in the Data Science concentration,DatascienceCrse
Courses in Data Science concentration,DatascienceCrse
What courses does Data Science Concentration contain,DatascienceCrse
Data Science Concentration courses,DatascienceCrse
